{
  "schemaVersion": 1,
  "baseSha": "1c5697219a7d3281f37d57981b5b548d7c1c9d5b",
  "evidenceClass": "documented",
  "runtimeChanges": false,
  "upstreams": [
    {
      "name": "A2A specification",
      "id": "a2a-spec",
      "url": "https://github.com/a2aproject/A2A",
      "tagOrCommit": "v1.0.0",
      "commit": "173695755607e884aa9acf8ce4feed90e32727a1",
      "pinEvidence": "https://api.github.com/repos/a2aproject/A2A/commits/v1.0.0",
      "license": "Apache-2.0",
      "licenseEvidence": [
        "https://github.com/a2aproject/A2A/blob/173695755607e884aa9acf8ce4feed90e32727a1/LICENSE"
      ],
      "apiEvidence": [
        "https://github.com/a2aproject/A2A/blob/173695755607e884aa9acf8ce4feed90e32727a1/specification/a2a.proto",
        "https://github.com/a2aproject/A2A/blob/173695755607e884aa9acf8ce4feed90e32727a1/docs/specification.md"
      ],
      "platformEvidence": [
        "https://github.com/a2aproject/A2A/blob/173695755607e884aa9acf8ce4feed90e32727a1/specification/a2a.proto"
      ],
      "securityNotes": "A2A v1.0 is the target; JSON-RPC SendMessage, not legacy message/send. No standard UNKNOWN; UNSPECIFIED is not uncertainty. Cancel acceptance is not proof of native cancellation.",
      "status": "documented",
      "lastChecked": "2026-10-26",
      "decision": "ADOPT",
      "sourcePaths": [
        "LICENSE",
        "specification/a2a.proto",
        "docs/specification.md"
      ],
      "platformVerification": {
        "macOS": null,
        "Windows": null
      },
      "transitiveLicenseReview": "unknown — no new installation or runtime adoption approved",
      "runtimeDependencyApproved": false
    },
    {
      "name": "A2A JavaScript SDK",
      "id": "a2a-js",
      "url": "https://github.com/a2aproject/a2a-js",
      "tagOrCommit": "v1.3.0",
      "commit": "29417a5bb4038f804f310ce4fffd267a9375aa90",
      "pinEvidence": "https://api.github.com/repos/a2aproject/a2a-js/commits/v1.3.0",
      "license": "Apache-2.0",
      "licenseEvidence": [
        "https://github.com/a2aproject/a2a-js/blob/29417a5bb4038f804f310ce4fffd267a9375aa90/LICENSE"
      ],
      "apiEvidence": [
        "https://github.com/a2aproject/a2a-js/blob/29417a5bb4038f804f310ce4fffd267a9375aa90/package.json",
        "https://github.com/a2aproject/a2a-js/blob/29417a5bb4038f804f310ce4fffd267a9375aa90/src/types/index.ts",
        "https://github.com/a2aproject/a2a-js/blob/29417a5bb4038f804f310ce4fffd267a9375aa90/src/types/pb/a2a.ts",
        "https://github.com/a2aproject/a2a-js/blob/29417a5bb4038f804f310ce4fffd267a9375aa90/src/client/index.ts"
      ],
      "platformEvidence": [
        "https://github.com/a2aproject/a2a-js/blob/29417a5bb4038f804f310ce4fffd267a9375aa90/README.md"
      ],
      "securityNotes": "Node >=20. Root jose ^6.2.3; optional Express/gRPC/database peers must be separately locked/reviewed. Default owner resolver groups anonymous users into unknown. Agent-card helper defaults to public max-age=3600; private scoped cards require authentication before helper and no-store cache isolation.",
      "status": "documented",
      "lastChecked": "2026-10-26",
      "decision": "ADAPT",
      "sourcePaths": [
        "README.md",
        "package.json",
        "LICENSE",
        "src/types/index.ts",
        "src/types/pb/a2a.ts",
        "src/client/index.ts",
        "src/client/transports/json_rpc_transport.ts",
        "src/server/request_handler/default_request_handler.ts",
        "src/server/owner_resolver.ts",
        "src/server/authentication/user.ts",
        "src/server/express/agent_card_handler.ts"
      ],
      "platformVerification": {
        "macOS": null,
        "Windows": null
      },
      "transitiveLicenseReview": "unknown — no new installation or runtime adoption approved",
      "runtimeDependencyApproved": false
    },
    {
      "name": "MCP TypeScript SDK",
      "id": "mcp",
      "url": "https://github.com/modelcontextprotocol/typescript-sdk",
      "tagOrCommit": "v2.4.0",
      "commit": "951fe5603a7ec0b2dcb6a0b95d92cd86f93ad9e5",
      "pinEvidence": "https://api.github.com/repos/modelcontextprotocol/typescript-sdk/commits/v2.4.0",
      "license": "Apache-2.0 AND MIT AND CC-BY-4.0",
      "licenseEvidence": [
        "https://github.com/modelcontextprotocol/typescript-sdk/blob/951fe5603a7ec0b2dcb6a0b95d92cd86f93ad9e5/LICENSE"
      ],
      "apiEvidence": [
        "https://github.com/modelcontextprotocol/typescript-sdk/blob/951fe5603a7ec0b2dcb6a0b95d92cd86f93ad9e5/packages/server/package.json",
        "https://github.com/modelcontextprotocol/typescript-sdk/blob/951fe5603a7ec0b2dcb6a0b95d92cd86f93ad9e5/packages/client/package.json",
        "https://github.com/modelcontextprotocol/typescript-sdk/blob/951fe5603a7ec0b2dcb6a0b95d92cd86f93ad9e5/packages/core/package.json",
        "https://github.com/modelcontextprotocol/typescript-sdk/blob/951fe5603a7ec0b2dcb6a0b95d92cd86f93ad9e5/docs/protocol-versions.md"
      ],
      "platformEvidence": [
        "https://github.com/modelcontextprotocol/typescript-sdk/blob/951fe5603a7ec0b2dcb6a0b95d92cd86f93ad9e5/packages/server/package.json"
      ],
      "securityNotes": "Existing exact 2.4.0 server/client/core. Package manifests declare Apache-2.0, but root LICENSE explicitly retains unconsented MIT contributions and licenses non-spec documentation CC-BY-4.0. Composite is repository scope, not a per-file relicensing conclusion; attribution completeness remains unknown. Keep stdio and existing scoped policy; SDK version is not protocol revision.",
      "status": "documented",
      "lastChecked": "2026-10-26",
      "decision": "ADOPT",
      "sourcePaths": [
        "LICENSE",
        "packages/server/package.json",
        "packages/client/package.json",
        "packages/core/package.json",
        "docs/protocol-versions.md",
        "SECURITY.md",
        ".github/workflows/main.yml"
      ],
      "platformVerification": {
        "macOS": null,
        "Windows": null
      },
      "transitiveLicenseReview": "unknown — no new installation or runtime adoption approved",
      "runtimeDependencyApproved": false
    },
    {
      "name": "AGNTCY SLIM",
      "id": "slim",
      "url": "https://github.com/agntcy/slim",
      "tagOrCommit": "cd505c2cf241481e44604b71a3d2d6d5d43c7839",
      "commit": "cd505c2cf241481e44604b71a3d2d6d5d43c7839",
      "pinEvidence": "https://api.github.com/repos/agntcy/slim/commits/cd505c2cf241481e44604b71a3d2d6d5d43c7839",
      "license": "Apache-2.0",
      "licenseEvidence": [
        "https://github.com/agntcy/slim/blob/cd505c2cf241481e44604b71a3d2d6d5d43c7839/LICENSE.md"
      ],
      "apiEvidence": [
        "https://github.com/agntcy/slim/blob/cd505c2cf241481e44604b71a3d2d6d5d43c7839/Cargo.toml",
        "https://github.com/agntcy/slim/blob/cd505c2cf241481e44604b71a3d2d6d5d43c7839/config/base/server-config.yaml",
        "https://github.com/agntcy/slim/blob/cd505c2cf241481e44604b71a3d2d6d5d43c7839/config/reference/config.yaml",
        "https://github.com/agntcy/slim/blob/cd505c2cf241481e44604b71a3d2d6d5d43c7839/.github/workflows/reusable-rust-build-and-test.yaml"
      ],
      "platformEvidence": [
        "https://github.com/agntcy/slim/blob/cd505c2cf241481e44604b71a3d2d6d5d43c7839/README.md"
      ],
      "securityNotes": "Workspace commit, not one monolithic release. Base example binds 0.0.0.0:46357 with insecure TLS; this is an example configuration, not proof of all compiled defaults. Rust/MLS/crypto and optional coordinator/control plane increase dependencies; no transport replacement.",
      "status": "documented",
      "lastChecked": "2026-10-26",
      "decision": "DEFER",
      "sourcePaths": [
        "LICENSE.md",
        "README.md",
        "Cargo.toml",
        "config/base/server-config.yaml",
        "config/reference/config.yaml",
        ".github/workflows/reusable-rust-build-and-test.yaml"
      ],
      "platformVerification": {
        "macOS": null,
        "Windows": null
      },
      "transitiveLicenseReview": "unknown — no new installation or runtime adoption approved",
      "runtimeDependencyApproved": false
    },
    {
      "name": "AGNTCY Directory",
      "id": "dir",
      "url": "https://github.com/agntcy/dir",
      "tagOrCommit": "v1.8.0",
      "commit": "337ddd89721bd66595c701c9675d6bfbb5a65997",
      "pinEvidence": "https://api.github.com/repos/agntcy/dir/commits/v1.8.0",
      "license": "Apache-2.0",
      "licenseEvidence": [
        "https://github.com/agntcy/dir/blob/337ddd89721bd66595c701c9675d6bfbb5a65997/LICENSE.md"
      ],
      "apiEvidence": [
        "https://github.com/agntcy/dir/blob/337ddd89721bd66595c701c9675d6bfbb5a65997/server/go.mod",
        "https://github.com/agntcy/dir/blob/337ddd89721bd66595c701c9675d6bfbb5a65997/api/go.mod",
        "https://github.com/agntcy/dir/blob/337ddd89721bd66595c701c9675d6bfbb5a65997/server/config/config.go",
        "https://github.com/agntcy/dir/blob/337ddd89721bd66595c701c9675d6bfbb5a65997/server/authn/config/config.go"
      ],
      "platformEvidence": [
        "https://github.com/agntcy/dir/blob/337ddd89721bd66595c701c9675d6bfbb5a65997/README.md"
      ],
      "securityNotes": "Default gRPC 0.0.0.0:8888; metrics enabled :9090; authn/authz default false; REST gateway default false. Registry/OASF schema, optional SPIFFE/OCI/relay are deployment dependencies; discovery does not establish trust.",
      "status": "documented",
      "lastChecked": "2026-10-26",
      "decision": "DEFER",
      "sourcePaths": [
        "LICENSE.md",
        "README.md",
        "api/LICENSE.md",
        "client/LICENSE.md",
        "server/go.mod",
        "api/go.mod",
        "server/config/config.go",
        "server/authn/config/config.go",
        "server/authz/config/config.go",
        "install/docker/server.config.yml"
      ],
      "platformVerification": {
        "macOS": null,
        "Windows": null
      },